{"$schema":"https://json-schema.org/draft/2020-12/schema","title":"Critical reading v5","type":"object","required":["reading_id","object_id","kind","source_id","locator","tokens","status"],"properties":{"reading_id":{"type":"string"},"object_id":{"type":"string"},"surface_id":{"type":["string","null"]},"kind":{"enum":["diplomatic","normalized","secondary","restoration"]},"source_id":{"type":"string"},"locator":{"type":"string","minLength":1},"tokens":{"type":"array","items":{"type":"object","required":["position","form","certainty"],"properties":{"position":{"type":"integer","minimum":1},"form":{"type":"string"},"certainty":{"enum":["secure","probable","uncertain","illegible"]},"editorial":{"type":["string","null"]}}}},"status":{"enum":["source-encoded","source-checked","disputed","superseded"]},"supersedes":{"type":"array","items":{"type":"string"}}},"additionalProperties":false}